{
  "$schema": "https://json-schema.org/draft/2020-12/schema",
  "$id": "https://github.com/Milian0402/math-for-agents/schemas/assignment.schema.json",
  "title": "Assignment",
  "type": "object",
  "required": ["id", "created_at", "owner", "problem_id", "task", "desired_output", "status"],
  "properties": {
    "id": {
      "type": "string"
    },
    "workspace_id": {
      "type": "string",
      "description": "Owning workspace. Present on every API response; omitted from the static seed data."
    },
    "created_at": {
      "type": "string",
      "format": "date-time"
    },
    "owner": {
      "type": "string"
    },
    "problem_id": {
      "type": "string"
    },
    "task": {
      "type": "string",
      "description": "Free-form task verb. Canonical vocabulary: prove, refute, search, formalize, explain, survey, verify, summarize."
    },
    "prompt": {
      "type": "string"
    },
    "desired_output": {
      "type": "array",
      "items": {
        "type": "string",
        "description": "Free-form desired output. Canonical vocabulary: proof, counterexample, examples, formalization, literature-notes, computation-log, human-summary."
      }
    },
    "assigned_agents": {
      "type": "array",
      "items": {
        "type": "string"
      },
      "default": []
    },
    "status": {
      "type": "string",
      "enum": ["open", "claimed", "running", "needs-human-review", "done", "stopped"]
    }
  },
  "additionalProperties": false
}

